{
  "@context": [
    "https://w3id.org/moochub/draft/context.jsonld",
    {
      "@language": "de"
    }
  ],
  "id": "urn:uuid:c96a2376-bdf2-4307-a21f-19a4ff141b5f",
  "url": "https://futurelearnlab.de/detailpage.php?id=18",
  "name": {
    "de": "Digital Trainer (Gesamtkurs)"
  },
  "type": ["LearningResource", "Course"],
  "publisher": {
    "id": "https://example.org/organizations/isy",
    "name": {
      "de": "Institut für Interaktive Systeme"
    },
    "type": "Organization"
  },
  "creator": [
    {
      "id": "https://example.org/people/beispielperson",
      "type": "Person",
      "name": "Beispielperson"
    }
  ],
  "license": {
    "type": "License",
    "identifier": "Propriatary"
  },
  "educationalCredentialAwarded": [
    {
      "id": "urn:uuid:1f9d2f1d-2d30-4d18-9e0e-12c004a1cf15",
      "name": {
        "de": "Digital Education Microcredential"
      },
      "type": "EducationalOccupationalCredential",
      "publisher": {
        "id": "https://example.org/organizations/example-university",
        "type": "Organization",
        "name": {
          "de": "Example University"
        }
      },
      "inLanguage": ["de", "en"],
      "numberOfCredits": [
        {
          "type": "CreditPoint",
          "framework": {
            "id": "http://data.europa.eu/snb/education-credit/6fcec5c5af",
            "type": "Concept",
            "prefLabel": {
              "en": "ECTS"
            },
            "inScheme": "http://data.europa.eu/snb/education-credit/25831c2"
          },
          "point": 5
        }
      ],
      "educationalLevel": [
        {
          "id": "https://w3id.org/kim/educationalLevel/level_6",
          "type": "Concept",
          "prefLabel": {
            "en": "Bachelor level"
          },
          "inScheme": "https://w3id.org/kim/educationalLevel/"
        }
      ],
      "educationalAlignment": [
        {
          "type": "AlignmentObject",
          "alignmentType": "educationalSubject",
          "educationalFramework": "ISCED-F",
          "targetName": {
            "en": "Computer use"
          },
          "targetUrl": "http://data.europa.eu/esco/isced-f/0611"
        }
      ],
      "isAwardedBy": [
        {
          "id": "https://provider.example/courses/digital-education",
          "name": {
            "en": "Digital Education Course"
          },
          "type": ["LearningResource", "Course"]
        },
        {
          "id": "https://provider.example/programs/digital-education",
          "name": {
            "en": "Digital Education Program"
          },
          "type": "EducationalOccupationalProgram"
        }
      ],
      "credentialCategory": {
        "id": "http://data.europa.eu/snb/credential/e34929035b",
        "type": "Concept",
        "prefLabel": {
          "de": "Generisch"
        },
        "inScheme": "http://data.europa.eu/snb/credential/25831c2"
      },
      "recognizedBy": [
        {
          "id": "https://example.org/organizations/example-university",
          "type": "Organization",
          "name": {
            "de": "Example University"
          }
        }
      ],
      "hasPart": [
        {
          "id": "https://example.org/credentials/digital-teaching-badge",
          "name": {
            "en": "Digital Teaching Badge"
          },
          "type": "EducationalOccupationalCredential"
        },
        {
          "id": "urn:uuid:c9a1ca5d-e63b-4a34-9d49-1ec0b3c378f2",
          "name": {
            "en": "Learning Design Badge"
          },
          "type": "EducationalOccupationalCredential"
        }
      ],
      "isPartOf": [
        {
          "id": "urn:uuid:7d2e42a8-15f9-4a39-8ac1-79d9b4d20d72",
          "name": {
            "en": "Certificate in Digital Education"
          },
          "type": "EducationalOccupationalCredential"
        }
      ]
    }
  ]
}
