{
  "@context": [
    "https://w3id.org/moochub/4.0.0/context.jsonld",
    {
      "@language": "de"
    }
  ],
  "id": "urn:uuid:c96a2376-bdf2-4307-a21f-19a4ff141b5f",
  "url": "https://futurelearnlab.de/detailpage.php?id=18",
  "name": {
    "de": "Digital Trainer (Gesamtkurs)"
  },
  "type": ["LearningResource", "Course"],
  "publisher": {
    "id": "https://example.org/organizations/isy",
    "name": {
      "de": "Institut für Interaktive Systeme"
    },
    "type": "Organization"
  },
  "creator": [
    {
      "id": "https://example.org/people/beispielperson",
      "type": "Person",
      "name": "Beispielperson"
    }
  ],
  "license": {
    "type": "License",
    "identifier": "Propriatary"
  },
  "educationalCredentialAwarded": [
    {
      "id": "https://example.org/credentials/digital-teaching-badge",
      "name": {
        "de": "Digital Teaching Badge"
      },
      "type": "EducationalOccupationalCredential",
      "competencyRequired": [
        {
          "id": "https://example.org/competencies/digital-teaching",
          "type": "Competency",
          "name": {
            "en": "Digital teaching"
          }
        }
      ],
      "educationalLevel": [
        {
          "id": "https://w3id.org/kim/educationalLevel/level_6",
          "type": "Concept",
          "prefLabel": {
            "de": "Bachelor oder äquivalent",
            "en": "Bachelor or equivalent"
          }
        }
      ],
      "credentialCategory": {
        "id": "http://data.europa.eu/snb/credential/e34929035b",
        "type": "Concept",
        "inScheme": "http://data.europa.eu/snb/credential/25831c2"
      },
      "recognizedBy": [
        {
          "id": "https://example.org/organizations/example-academy",
          "type": "Organization",
          "name": {
            "de": "Example Academy"
          }
        }
      ],
      "description": [
        {
          "type": "TextObject",
          "inLanguage": "de",
          "text": "Dieses Badge bescheinigt die erfolgreiche Teilnahme am Kurs Digital Trainer (Gesamtkurs).",
          "encodingFormat": "text/plain"
        }
      ],
      "url": "https://example.org/credentials/digital-teaching-badge",
      "image": {
        "type": "ImageObject",
        "contentUrl": "https://example.org/images/digital-teaching-badge.png",
        "license": {
          "type": "License",
          "id": "https://creativecommons.org/licenses/by/4.0/",
          "identifier": "CC BY 4.0"
        }
      }
    }
  ]
}
